{
  "catalog": 1,
  "seq": 12,
  "generated": "2026-10-18T09:00:00Z",
  "key": "cat1",
  "base": "https://ignacio-aranda.github.io/pauta/catalog/v1/",
  "plugins": [
    {"id": "pauta", "kind": "native", "version": "1.2.0", "api": "1.0", "min_firmware": "1.2.0", "bundled": "1.2.0",
     "name": {"es": "Pauta", "en": "Pauta"},
     "summary": {"es": "La checklist de tu escritorio.", "en": "The checklist on your desk."},
     "icon": "pauta", "category": "trabajo", "author": "Ignacio Aranda", "license": "MIT",
     "permissions": ["freetext", "notify"]},
    {"id": "nicscom", "kind": "native", "version": "1.0.0", "api": "1.0", "min_firmware": "1.5.0", "bundled": "1.5.0",
     "name": {"es": "nicscom", "en": "nicscom"},
     "summary": {"es": "Pauta como un nodo más de nicscom.", "en": "Pauta as one more nicscom node."},
     "icon": "antenna", "category": "comunicacion", "author": "Ignacio Aranda", "license": "MIT",
     "permissions": ["lan", "mqtt", "alert.critical", "notify"], "flags": ["needs_lan"]},
    {"id": "pomodoro", "kind": "recipe", "version": "1.0.0", "api": "1.0", "min_firmware": "1.3.0", "bundled": "1.3.0",
     "name": {"es": "Pomodoro", "en": "Pomodoro"},
     "summary": {"es": "Temporizador grande de trabajo y descanso.", "en": "Big work and break timer."},
     "icon": "timer", "category": "trabajo", "author": "Ignacio Aranda", "license": "MIT",
     "permissions": ["notify", "alert.critical"],
     "file": "p/pomodoro/1.0.0.json", "bytes": 7412,
     "sha256": "3b1f0c2d9e8a7b6c5d4e3f2a1b0c9d8e7f6a5b4c3d2e1f0a9b8c7d6e5f4a3b2c", "perm": "1c0e7a42",
     "shot": "p/pomodoro/1.0.0.png"},
    {"id": "semaforo", "kind": "recipe", "version": "1.0.1", "api": "1.0", "min_firmware": "1.6.0", "bundled": "1.6.0",
     "name": {"es": "Semáforo", "en": "Status lights"},
     "summary": {"es": "Vigila tus webs y servicios.", "en": "Watches your sites and services."},
     "icon": "lights", "category": "trabajo", "author": "Ignacio Aranda", "license": "MIT",
     "permissions": ["net.user", "notify"], "optional_permissions": ["lan"], "user_hosts": true,
     "file": "p/semaforo/1.0.1.json", "bytes": 11980,
     "sha256": "a0b1c2d3e4f5061728394a5b6c7d8e9f00112233445566778899aabbccddeeff", "perm": "77d0e113"}
  ]
}
